{
  "id": "channel-sweden",
  "date": "2026-09-15",
  "theme": "product",
  "status": "accepted",
  "claim": "Telegram är fel default för hosted i Sverige: bara några procent av barn 8–19 använder det. WhatsApp leder (~40 %). Barn utan egen mobil (fler 9-åringar) behöver fallback — men den som har lur lever i chatten, inte i en web-PWA.",
  "evidence": [
    {
      "title": "Internetstiftelsen — Barnen och internet 2025 (sammanfattning)",
      "url": "https://svenskarnaochinternet.se/app/uploads/2025/11/internetstiftelsen-barnen-och-internet-2025-sammanfattning.pdf",
      "year": 2025,
      "notes": "WhatsApp vanligaste kommunikationsappen bland 8–19, cirka 4 av 10. Discord cirka en fjärdedel. Signal och Telegram några få procent."
    },
    {
      "title": "Mediemyndigheten — Ungar & medier 2025",
      "url": "https://mediemyndigheten.se/globalassets/rapporter-och-analyser/ungar--medier/mediemyndigheten-rapport-ungar-och-medier.pdf",
      "year": 2025,
      "notes": "Färre 9-åringar har egen mobil (nästan fördubblad andel utan sedan 2022). Läxa sker ofta på delad platta. Sociala medier minskar under 13 men hälften av 9–12 använder fortfarande."
    }
  ],
  "implication": "WhatsApp-kontakt är Hem-barnets default (P-32). Telegram Open (P-30). PWA är föräldern + fallback för barn utan chattapp (P-27). Inte 'bor i Telegram-gruppen'.",
  "backlog_refs": ["P-32", "P-30", "P-27"],
  "confidence": "high"
}
